{
  "schema_version": "0.2.0",
  "id": "japandi",
  "version": 1,
  "status": "draft",
  "style_direction": "Japandi",
  "summary": "Pale timber, linen texture, low visual weight, and generous negative space make the same room feel calm without disguising the rental.",
  "locked_elements": [
    "room geometry",
    "camera viewpoint",
    "existing sofa",
    "existing dining table",
    "north windows",
    "wood-look flooring",
    "radiator",
    "HVAC register",
    "entry door",
    "outlets",
    "ceiling junction"
  ],
  "allowed_changes": [
    "coffee table",
    "floor lamp",
    "removable textiles",
    "freestanding storage",
    "plants",
    "no-drill art"
  ],
  "decisions": [],
  "renders": [
    {
      "path": "assets/generated/japandi.png",
      "provider": "banana",
      "created_at": "2026-07-18T00:00:00Z",
      "disclaimer": "Visual approximation — verify dimensions, color, material, and availability before purchasing."
    }
  ]
}
